{"task_id":"GENERIC-001","objective":"Generic offline orchestration sample.","background":"Independent of review-writer task IDs.","frozen_decisions":["No fallback."],"allowed_paths":["docs/agent-tasks/examples/"],"forbidden_paths":[".env"],"inputs":["sample"],"required_outputs":["WORKER_RESULT"],"acceptance_criteria":["offline validation"],"verification_commands":["python3 scripts/agent-orchestration/validate_task_package.py"],"safety_boundaries":["No nested codex exec."],"network_policy":"Offline.","model_policy":"No fallback.","stop_conditions":["scope expansion"],"human_checkpoint":"Leader review."}
